<?xml version="1.0" encoding="UTF-8"?>
<!--Sample XML file generated by XMLSpy v2009 sp1 (http://www.altova.com)-->
<Document xsi:schemaLocation="urn:cnaps:std:pbcs:2010:tech:xsd:pbcs.608.001.01 pbcs.608.001.01.xsd" xmlns="urn:cnaps:std:pbcs:2010:tech:xsd:pbcs.608.001.01" xmlns:xsi="http://www.w3.org/2001/XMLSchema-instance">
	<ChrgAndRtrList>
		<GrpHdr>
			<MsgId>2010090912345678</MsgId>
			<CreDtTm>2010-09-09T09:30:47</CreDtTm>
			<InstgPty>
				<InstgDrctPty>0000</InstgDrctPty>
				<InstgPty>0000</InstgPty>
			</InstgPty>
			<InstdPty>
				<InstdDrctPty>103100000018</InstdDrctPty>
				<InstdPty>103100000018</InstdPty>
			</InstdPty>
			<SysCd>PBCS</SysCd>
			<Rmk>a</Rmk>
		</GrpHdr>
		<ChrgAndRtrListInf>
			<ChrgTp>CT00</ChrgTp>
			<ChrgPtcpt>103100000018</ChrgPtcpt>
			<ChrgMnth>201008</ChrgMnth>
			<StartDt>2010-08-01</StartDt>
			<EndDt>2010-08-31</EndDt>
			<TtlAmt Ccy="CNY">1000.00</TtlAmt>
			<NbOfSys>1</NbOfSys>
			<ChrgInf>
				<ChrgSys>HVPS</ChrgSys>
				<Amt Ccy="CNY">1000.00</Amt>
			</ChrgInf>
		</ChrgAndRtrListInf>
	</ChrgAndRtrList>
</Document>
